{
  "key": "metan",
  "name": "四国めたん",
  "description": "Shikoku Metan character voice - explainer role (VOICEVOX default values - verify speakerId/styleId against your VOICEVOX instance)",
  "voice": {
    "engineId": "074fc39e-678b-4c13-8916-ffca8d505d1d",
    "speakerId": "7ffcb7ce-00ec-4bdc-82cd-45a8889e43ff",
    "styleId": 2
  },
  "emotionStyles": {
    "normal": 2,
    "amaama": 0,
    "tsuntsun": 6,
    "hisohiso": 4
  },
  "profile": {
    "gender": "female",
    "age_range": "young_adult",
    "knowledge_level": "expert",
    "personality_traits": [
      "論理的",
      "ツンデレ",
      "丁寧",
      "知識豊富"
    ],
    "speech_register": "polite_desu_masu",
    "sentence_patterns": {
      "typical_endings": [
        "です",
        "ます",
        "でしょう",
        "なの",
        "わよ"
      ],
      "filler_words": [
        "まあ",
        "ちょっと"
      ],
      "catchphrases": [
        "簡単に説明すると",
        "わかった？",
        "ポイントはね"
      ],
      "forbidden_patterns": [
        "〜なのだ",
        "ぼくは",
        "存じます",
        "ございます"
      ]
    },
    "interaction_behavior": {
      "explains_by": "logical_steps",
      "responds_to_questions_by": "stepwise_breakdown",
      "emotion_range": "moderate"
    },
    "topic_affinity": {
      "enthusiastic_about": [
        "技術的な仕組み",
        "わかりやすい説明",
        "正確な情報"
      ],
      "cautious_about": [
        "曖昧な表現",
        "根拠のない主張"
      ]
    }
  }
}
